A1: 名称 | B1: 代码 | C1: 行业 | D1: 总市值 | E1: 市盈率(动) | F1: 现价 | G1: 净资 | H1: 目标市净率 | I1: 目标价 | J1: 上涨空间(%) | K1: 性质
A2: 海螺水泥 | B2: 600585 | C2: 建筑材料 | D2: 1534亿 | E2: 9.27 | F2: 28.25 | G2: 34.09 | H2: 1.5 | I2: =G2*H2 -> 51.135 | J2: =ROUND((I2-F2)/F2*100,2) -> 81.01 | K2: 价值股
A3: 特变电工 | B3: 600089 | C3: 电力设备 | D3: 834.6亿 | E3: 5.66 | F3: 21.71 | G3: 12.89 | H3: 3 | I3: =G3*H3 -> 38.67 | J3: =ROUND((I3-F3)/F3*100,2) -> 78.12 | K3: 成长股
A4: 中国平安 | B4: 601318 | C4: 非银金融 | D4: 8445亿 | E4: 10.08 | F4: 45.6 | G4: 46.97 | H4: 1.7 | I4: =G4*H4 -> 79.849 | J4: =ROUND((I4-F4)/F4*100,2) -> 75.11 | K4: 价值股
A5: 上港集团 | B5: 600018 | C5: 交通运输 | D5: 1292亿 | E5: 6.23 | F5: 5.54 | G5: 4.75 | H5: 2 | I5: =G5*H5 -> 9.5 | J5: =ROUND((I5-F5)/F5*100,2) -> 71.48 | K5: 价值股
A6: 特锐德 | B6: 300001 | C6: 电力设备 | D6: 186.1亿 | E6: 132.88 | F6: 17.65 | G6: 5.88 | H6: 4.8 | I6: =G6*H6 -> 28.224 | J6: =ROUND((I6-F6)/F6*100,2) -> 59.91 | K6: 成长股
A7: H股ETF | B7: 510900 | C7: -- | D7: -- | E7: -- | F7: 0.821 | G7: -- | I7: 1.3 | J7: =ROUND((I7-F7)/F7*100,2) -> 58.34 | K7: 成长股
A8: 通威股份 | B8: 600438 | C8: 电力设备 | D8: 1758亿 | E8: 6.07 | F8: 38.91 | G8: 12.16 | H8: 5 | I8: =G8*H8 -> 60.8 | J8: =ROUND((I8-F8)/F8*100,2) -> 56.26 | K8: 成长股
A9: 伊利股份 | B9: 600887 | C9: 食品饮料 | D9: 1864亿 | E9: 17.34 | F9: 29.12 | G9: 7.5 | H9: 6 | I9: =G9*H9 -> 45 | J9: =ROUND((I9-F9)/F9*100,2) -> 54.53 | K9: 价值股
A10: 保利发展 | B10: 600048 | C10: 房地产 | D10: 1717亿 | E10: 9.83 | F10: 14.13 | G10: 15.26 | H10: 1.4 | I10: =G10*H10 -> 21.364 | J10: =ROUND((I10-F10)/F10*100,2) -> 51.2 | K10: 价值股
A11: 医药ETF | B11: 512010 | C11: -- | D11: -- | E11: -- | F11: 0.47 | G11: -- | I11: 0.7 | J11: =ROUND((I11-F11)/F11*100,2) -> 48.94 | K11: 成长股
A12: 美的集团 | B12: 000333 | C12: 家用电器 | D12: 3645亿 | E12: 11.17 | F12: 53.81 | G12: 19.89 | H12: 4 | I12: =G12*H12 -> 79.56 | J12: =ROUND((I12-F12)/F12*100,2) -> 47.85 | K12: 价值股
A13: 科创板50 | B13: 588080 | C13: -- | D13: -- | E13: -- | F13: 1.104 | G13: -- | I13: 1.6 | J13: =ROUND((I13-F13)/F13*100,2) -> 44.93 | K13: 成长股
A14: 招商银行 | B14: 600036 | C14: 银行 | D14: 8683亿 | E14: 6.29 | F14: 34.27 | G14: 32.71 | H14: 1.5 | I14: =G14*H14 -> 49.065 | J14: =ROUND((I14-F14)/F14*100,2) -> 43.17 | K14: 价值股
A15: 大秦铁路 | B15: 601006 | C15: 交通运输 | D15: 1082亿 | E15: 7.51 | F15: 7.19 | G15: 8.4 | H15: 1.2 | I15: =G15*H15 -> 10.08 | J15: =ROUND((I15-F15)/F15*100,2) -> 40.19 | K15: 价值股
A16: 明阳智能 | B16: 601615 | C16: 电力设备 | D16: 511.9亿 | E16: 10.77 | F16: 22.51 | G16: 12.41 | H16: 2.5 | I16: =G16*H16 -> 31.025 | J16: =ROUND((I16-F16)/F16*100,2) -> 37.83 | K16: 成长股
A17: 中国核电 | B17: 601985 | C17: 公用事业 | D17: 1237亿 | E17: 11.55 | F17: 6.39 | G17: 4.34 | H17: 2 | I17: =G17*H17 -> 8.68 | J17: =ROUND((I17-F17)/F17*100,2) -> 35.84 | K17: 价值股
A18: 医药50 | B18: 512120 | C18: -- | D18: -- | E18: -- | F18: 0.516 | G18: -- | I18: 0.7 | J18: =ROUND((I18-F18)/F18*100,2) -> 35.66 | K18: 成长股
A19: 中概互联 | B19: 513050 | C19: -- | D19: -- | E19: -- | F19: 1.112 | G19: -- | I19: 1.5 | J19: =ROUND((I19-F19)/F19*100,2) -> 34.89 | K19: 成长股
A20: 光伏龙头 | B20: 159609 | C20: -- | D20: -- | E20: -- | F20: 0.778 | G20: -- | I20: 1 | J20: =ROUND((I20-F20)/F20*100,2) -> 28.53 | K20: 成长股
A21: 新 和 成 | B21: 002001 | C21: 医药生物 | D21: 549.9亿 | E21: 13.7 | F21: 17.95 | G21: 7.44 | H21: 3 | I21: =G21*H21 -> 22.32 | J21: =ROUND((I21-F21)/F21*100,2) -> 24.35 | K21: 价值股
A22: 超图软件 | B22: 300036 | C22: 计算机 | D22: 114.6亿 | E22: 亏损 | F22: 23.4 | G22: 5.75 | H22: 5 | I22: =G22*H22 -> 28.75 | J22: =ROUND((I22-F22)/F22*100,2) -> 22.86 | K22: 成长股
A23: 地产ETF | B23: 512200 | C23: -- | D23: -- | E23: -- | F23: 0.678 | G23: -- | I23: 0.83 | J23: =ROUND((I23-F23)/F23*100,2) -> 22.42 | K23: 价值股
A24: 创业板50 | B24: 159949 | C24: -- | D24: -- | E24: -- | F24: 1.02 | G24: -- | I24: 1.247 | J24: =ROUND((I24-F24)/F24*100,2) -> 22.25 | K24: 成长股
A25: 安琪酵母 | B25: 600298 | C25: 食品饮料 | D25: 348.3亿 | E25: 29.12 | F25: 41.75 | G25: 10.14 | H25: 5 | I25: =G25*H25 -> 50.7 | J25: =ROUND((I25-F25)/F25*100,2) -> 21.44 | K25: 价值股
A26: 证券ETF | B26: 159841 | C26: -- | D26: -- | E26: -- | F26: 0.825 | G26: -- | I26: 1 | J26: =ROUND((I26-F26)/F26*100,2) -> 21.21 | K26: 价值股
A27: HS300ETF | B27: 510310 | C27: -- | D27: -- | E27: -- | F27: 1.928 | G27: -- | I27: 2.3 | J27: =ROUND((I27-F27)/F27*100,2) -> 19.29 | K27: 价值股
A28: 中航光电 | B28: 002179 | C28: 国防军工 | D28: 881.9亿 | E28: 32.46 | F28: 54.08 | G28: 10.67 | H28: 6 | I28: =G28*H28 -> 64.02 | J28: =ROUND((I28-F28)/F28*100,2) -> 18.38 | K28: 成长股
A29: 银行 | B29: 515290 | C29: -- | D29: -- | E29: -- | F29: 0.933 | G29: -- | I29: 1.1 | J29: =ROUND((I29-F29)/F29*100,2) -> 17.9 | K29: 价值股
A30: 上海机场 | B30: 600009 | C30: 交通运输 | D30: 1364亿 | E30: 亏损 | F30: 55.73 | G30: 16.31 | H30: 4 | I30: =G30*H30 -> 65.24 | J30: =ROUND((I30-F30)/F30*100,2) -> 17.06 | K30: 价值股
A31: 新汽车 | B31: 515030 | C31: -- | D31: -- | E31: -- | F31: 1.634 | G31: -- | I31: 1.9 | J31: =ROUND((I31-F31)/F31*100,2) -> 16.28 | K31: 成长股
A32: 交运ETF | B32: 159662 | C32: -- | D32: -- | E32: -- | F32: 1.034 | G32: -- | I32: 1.2 | J32: =ROUND((I32-F32)/F32*100,2) -> 16.05 | K32: 价值股
A33: 新材ETF | B33: 159761 | C33: -- | D33: -- | E33: -- | F33: 0.696 | G33: -- | I33: 0.8 | J33: =ROUND((I33-F33)/F33*100,2) -> 14.94 | K33: 成长股
A34: 长江电力 | B34: 600900 | C34: 公用事业 | D34: 4917亿 | E34: 19.47 | F34: 21.25 | G34: 8.04 | H34: 3 | I34: =G34*H34 -> 24.12 | J34: =ROUND((I34-F34)/F34*100,2) -> 13.51 | K34: 价值股
A35: 半导体 | B35: 512480 | C35: -- | D35: -- | E35: -- | F35: 0.977 | G35: -- | I35: 1.1 | J35: =ROUND((I35-F35)/F35*100,2) -> 12.59 | K35: 成长股
A36: 纳斯达克 | B36: 159632 | C36: -- | D36: -- | E36: -- | F36: 1.029 | G36: -- | I36: 1.1 | J36: =ROUND((I36-F36)/F36*100,2) -> 6.9 | K36: 成长股